question_id,question,answer,question_type,source_filenames,source_sections,source_chunk_ids,is_impossible,dataset_split
QA0466,Which process is required to regularly perform identity reviews of each of the organization's Identity Providers (IDPs)?,The organization shall use a defined process to regularly perform identity reviews of each of the organization's Identity Providers (IDPs) to ensure only authorized accounts exist in the system.,simple,SANS_Identity_Management_Policy_April2025.pdf,Safeguards,2,False,train
QA0467,How does the organization track the status of cybersecurity projects and issues that may cause information systems or software applications to be out of compliance with approved cybersecurity safeguards?,"The organization uses its cybersecurity project tracking system to track the status of each active cybersecurity project. This system also tracks issues that cause information systems or software applications to be out of compliance with the organization's approved cybersecurity safeguards. The system is used to document both cybersecurity projects and issues, and to track the status of each project and issue. It also tracks the capital and personnel implementation costs for each project and the approved cybersecurity exceptions that cause issues.",complex,SANS_Safeguard_Implementation_Management_Policy_April2025.pdf|SANS_Safeguard_Implementation_Management_Policy_April2025.pdf,Safeguards|Safeguards,0|1,False,train
QA0468,What are the factors that determine the classification of information?,"The classification of information is determined by the organization's information security needs, taking into account confidentiality, integrity, availability, and relevant interested party requirements.",simple,ISO-27001-Controls-List-Free-Download-pdf-.pdf,ISO_5.12,0,False,train
QA0469,What is the procedure for responding to information security incidents?,The policy states that information security incidents should be responded to in accordance with the documented procedures.,simple,ISO-27001-Controls-List-Free-Download-pdf-.pdf,ISO_5.26,0,False,train
QA0470,"What specific approvals are required for an AI system at YourCompanyName, and what are the potential consequences of failing to comply with these requirements?","To ensure compliance with contractual obligations and internal policies, all AI systems must undergo a comprehensive review process including a security review, privacy review, cost review, and spend approval, as well as legal review and human resources review. Failure to comply with these requirements can result in the use of the AI system being prohibited, as outlined in the prohibited uses section of the policy, which includes activities like political lobbying, using AI to categorize individuals based on protected class status, entering sensitive information into AI systems, and more.",complex,SANS_Artificial_Intelligence_Standard_April2025.pdf|SANS_Artificial_Intelligence_Standard_April2025.pdf,full|full,10|11,False,train
QA0471,What are the specific security measures to protect against unauthorized access to the database?,This policy snippet does not specify the specific security measures to protect against unauthorized access to the database.,negative,SANS_Database_Credentials_Standard_April2025.pdf,full,0,True,train
QA0472,What is the recommended storage location for database usernames and passwords?,Database usernames and passwords may be stored in a file separate from the executing body of the program's code. This file must not be world readable or writeable.,simple,SANS_Database_Credentials_Standard_April2025.pdf,full,1,False,train
QA0473,What are the specific requirements for the review and approval process for AI systems?,The policy snippet does not specify the exact requirements for the review and approval process for AI systems.,negative,SANS_Artificial_Intelligence_Standard_April2025.pdf,full,11,True,train
QA0474,"Who is responsible for reviewing, modifying, and removing access rights?",The organization's topic-specific policy dictates the responsibilities for access rights management.,simple,ISO-27001-Controls-List-Free-Download-pdf-.pdf,ISO_5.18,0,False,train
QA0475,What is the policy's focus?,"This policy outlines the necessary steps to safeguard records from various threats, ensuring their integrity and availability.",simple,ISO-27001-Controls-List-Free-Download-pdf-.pdf,ISO_5.33,0,False,train
QA0476,Who is responsible for ensuring the data inventory management system tracks data that should be masked in information systems?,The organization is responsible for ensuring the data inventory management system tracks data that should be masked in information systems.,simple,SANS_Data_Inventory_Management_Policy_April2025.pdf,Safeguards,1,False,train
QA0477,Which type of data is the MDM system intended to limit on mobile devices?,"The MDM system limits enterprise data on mobile devices to containerized, enterprise-managed applications.",simple,SANS_Mobile_Device_Management_Policy_April2025.pdf,Safeguards,0,False,train
QA0478,What is the organization's responsibility regarding information security during disruption?,The organization is responsible for planning how to maintain information security at an appropriate level during disruptions.,simple,ISO-27001-Controls-List-Free-Download-pdf-.pdf,ISO_5.29,0,False,train
QA0479,"According to the EU Artificial Intelligence Act, which high-risk AI system type is specifically required to have specific requirements on logging capabilities and human oversight, as well as a focus on robust cybersecurity measures?","The EU Artificial Intelligence Act specifically requires 'Real-time' and 'post' remote biometric identification systems to have specific requirements on logging capabilities and human oversight, as well as a focus on robust cybersecurity measures.  These systems are also subject to specific requirements on human oversight and logging capabilities due to their potential for misuse, bias, and potential for compromising fundamental rights.",complex,SANS_Artificial_Intelligence_Standard_April2025.pdf|SANS_Artificial_Intelligence_Standard_April2025.pdf,full|full,26|27,False,train
QA0480,What are the specific requirements for data retention periods?,This policy snippet does not specify requirements for data retention periods.,negative,SANS_Privacy_Management_Policy_April2025.pdf,Safeguards,1,True,train
QA0481,What is the primary concern regarding the use of AI systems?,The primary concern is the potential for AI systems to pose a high risk to the health and safety or fundamental rights of natural persons.,simple,SANS_Artificial_Intelligence_Standard_April2025.pdf,full,15,False,train
QA0482,What is considered sensitive information according to the policy?,"Sensitive information includes medical, financial, political affiliation, racial or ethnic origin, religious beliefs, gender, sexual orientation, disability status, or any other part of a persons life someone would want to keep private.",simple,SANS_Artificial_Intelligence_Standard_April2025.pdf,full,12,False,train
QA0483,Which specific access control mechanism is required for users and software accessing sensitive data?,Users and software accessing sensitive data must be subjected to proper access control and should not be able to perform privileged operations that are out of scope of said user and/or software.,simple,SANS_Database_Credentials_Standard_April2025.pdf,full,4,False,train
QA0484,What specific legal and contractual obligations must be considered when using AI systems for student assessments?,This policy snippet does not specify the specific legal and contractual obligations that must be considered when using AI systems for student assessments.,negative,SANS_Artificial_Intelligence_Standard_April2025.pdf,full,16,True,train
QA0485,What security measure is required to ensure only authorized users can remotely connect to the organization's network?,The organization's approved perimeter network firewalls require Multi-Factor Authentication (MFA) when authenticating all remote connections.,simple,SANS_Perimeter_Network_Access_Management_Policy_April2025.pdf,Safeguards,1,False,train
QA0486,"According to the policy, what are the key responsibilities of the stakeholder committee for the cybersecurity program?","The stakeholder committee responsible for the cybersecurity program is outlined in the charter, which defines its members, roles, responsibilities, meeting cadence, and rules of order. The charter also specifies that the committee members should be from a diverse set of business units, not just technology teams, to ensure representation across all aspects of the organization.",complex,SANS_Program_Management_Policy_April2025.pdf|SANS_Program_Management_Policy_April2025.pdf,Safeguards|Safeguards,0|1,False,train
QA0487,Who is responsible for ensuring that personnel apply information security policies?,Management is responsible for ensuring that personnel apply information security policies.,simple,ISO-27001-Controls-List-Free-Download-pdf-.pdf,ISO_5.4,0,False,train
QA0488,"According to the policy, what is the primary guiding principle for the use of AI at YourCompanyName, and what should be the focus of its implementation?",The primary guiding principle for the use of AI at YourCompanyName is to leverage AI as a tool while ensuring it continues to meet legal obligations and act in an ethical manner. The focus of its implementation should be on improving business efficiencies and enhancing YourCompanyNames ability to fulfill its mission.,complex,SANS_Artificial_Intelligence_Standard_April2025.pdf|SANS_Artificial_Intelligence_Standard_April2025.pdf,full|full,3|4,False,train
QA0489,"According to the EU regulations, what specific data quality attributes are essential for high-risk AI systems, and why are they important?","The EU regulations emphasize the importance of high-quality training, validation, and testing data sets for high-risk AI systems. These data sets must be relevant, representative, free of errors, complete, and possess appropriate statistical properties, considering the specific geographical, behavioral, or functional context of the AI system's intended use. This ensures that the AI system performs as intended and safely, avoiding discrimination prohibited by Union law.",complex,SANS_Artificial_Intelligence_Standard_April2025.pdf|SANS_Artificial_Intelligence_Standard_April2025.pdf,full|full,20|21,False,train
QA0490,Which types of AI systems are subject to specific requirements on logging capabilities and human oversight?,Real-time and post remote biometric identification systems are subject to specific requirements on logging capabilities and human oversight.,simple,SANS_Artificial_Intelligence_Standard_April2025.pdf,full,26,False,train
QA0491,What is the purpose of maintaining an inventory of network devices?,Maintaining an inventory of network devices helps the organization achieve its overall mission and cybersecurity goals.,simple,SANS_Network_Device_Management_Policy_April2025.docx,Safeguards,0,False,train
QA0492,Where should backup copies be maintained?,Backup copies should be maintained in accordance with the agreed topic-specific policy on backup.,simple,ISO-27001-Controls-List-Free-Download-pdf-.pdf,ISO_8.13,0,False,train
QA0493,Which network management system is required to manage network devices?,The organization must maintain a network device management system to manage each approved network device.,simple,SANS_Network_Device_Management_Policy_April2025.docx,Safeguards,0,False,train
QA0494,What is the purpose of the requirement for transparency in high-risk AI systems?,"Transparency aims to address the opacity of certain AI systems, making them understandable and usable by natural persons.",simple,SANS_Artificial_Intelligence_Standard_April2025.pdf,full,24,False,train
QA0495,What specific protocols or technologies must be used for data encryption when connecting to the organization's network?,This policy snippet does not specify the specific protocols or technologies that must be used for data encryption when connecting to the organization's network.,negative,SANS_Perimeter_Network_Access_Management_Policy_April2025.pdf,Safeguards,1,True,train
QA0496,What specific measures are outlined for enforcing the approved configuration benchmarks?,This policy snippet does not specify the specific measures for enforcing the approved configuration benchmarks.,negative,SANS_Configuration_Management_Policy_April2025.pdf,Safeguards,2,True,train
QA0497,Which actions should the removable media safeguard system take on computing systems that do not require removable storage media?,The system should disable removable storage media on such systems.,simple,SANS_System_Protection_Management_Policy_April2025.pdf,Safeguards,2,False,train
QA0498,Which system is required for the organization to achieve its cybersecurity goals?,The organization is required to maintain an Endpoint Detection and Response (EDR) system to detect and alert malicious activity on its computing systems.,simple,SANS_System_Protection_Management_Policy_April2025.pdf,Safeguards,0,False,train
QA0499,How does the organization's Vulnerability Management (VM) system detect weaknesses?,The organization's Vulnerability Management (VM) system uses agents and/or authenticated scans to detect weaknesses in the organization's information systems.,simple,SANS_Vulnerability_Management_Policy_April2025.pdf,Safeguards,0,False,train
QA0500,"What are the potential consequences of failing to comply with the Vulnerability Management (VM) policy, and how are those consequences related to the severity of a breach?","Failure to comply with the Vulnerability Management (VM) policy can lead to disciplinary action, ranging from training and warnings to suspension of remote access privileges or even termination of employment or contractual obligations. The severity of these consequences directly corresponds to the seriousness of the breach, emphasizing the critical importance of cybersecurity and the individual's role in protecting digital assets.",complex,SANS_Vulnerability_Management_Policy_April2025.pdf|SANS_Vulnerability_Management_Policy_April2025.pdf,Safeguards|Safeguards,1|2,False,train
QA0501,What type of connections does the organization need to maintain an inventory of?,"The organization must maintain an inventory of all approved perimeter network connections, including those to the internet and third-party services.",simple,SANS_Perimeter_Network_Access_Management_Policy_April2025.pdf,Safeguards,0,False,train
QA0502,What are the requirements for test information?,"The policy states that test information should be appropriately selected, protected, and managed.",simple,ISO-27001-Controls-List-Free-Download-pdf-.pdf,ISO_8.33,0,False,train
QA0503,What should a YourCompanyName Representative do before using any AI at YourCompanyName?,"A YourCompanyName Representative should consult with their manager and seek guidance before using any AI at YourCompanyName, whether for personal business tasks or more complex business processes.",simple,SANS_Artificial_Intelligence_Standard_April2025.pdf,full,5,False,train
QA0504,What is required for equipment security?,Equipment must be sited securely and protected.,simple,ISO-27001-Controls-List-Free-Download-pdf-.pdf,ISO_7.8,0,False,train
QA0505,Who is responsible for reporting cybersecurity incidents to those impacted by the incident?,The organization's documented Incident Management (IM) plan defines how to report a cybersecurity incident to those impacted by the incident.,simple,SANS_Resilience_Management_Policy_April2025.pdf,Safeguards,1,False,train
QA0506,Who is responsible for evaluating the organization's exposure to technical vulnerabilities?,The policy does not specify who is responsible for evaluating the organization's exposure to technical vulnerabilities.,simple,ISO-27001-Controls-List-Free-Download-pdf-.pdf,ISO_8.8,0,False,train
QA0507,What specific cybersecurity measures are required by this policy?,This policy snippet does not specify the exact cybersecurity measures required by the policy.,negative,SANS_Asset_Management_Policy_April2025.pdf,Policy Sanctions,0,True,train
QA0508,"According to the policy documents, what specific information must be included in the contract language when working with third-party vendors that handle sensitive data?",The contract language must include provisions requiring all third parties to implement a defined set of cybersecurity safeguards and specifying which safeguards are required. This also includes provisions requiring any third party that experiences a significant cybersecurity event to promptly report it to the organization.,complex,SANS_Third_Party_Management_Policy_April2025.pdf|SANS_Third_Party_Management_Policy_April2025.pdf,Safeguards|Safeguards,0|1,False,train
QA0509,What is the minimum redundancy required for information processing facilities?,The policy states that information processing facilities should have redundancy sufficient to meet availability requirements.,simple,ISO-27001-Controls-List-Free-Download-pdf-.pdf,ISO_8.14,0,False,train
QA0510,What is the purpose of the approved software application configuration benchmarks?,The approved software application configuration benchmarks serve as a guide to ensure that each of the organization's software applications is configured securely.,simple,SANS_Configuration_Management_Policy_April2025.pdf,Safeguards,2,False,train
QA0511,What is the purpose of ICT readiness planning?,ICT readiness planning is designed to ensure that ICT systems are prepared to meet business continuity objectives and requirements.,simple,ISO-27001-Controls-List-Free-Download-pdf-.pdf,ISO_5.30,0,False,train
QA0512,How does the organization ensure the effectiveness of its cybersecurity education program and what are the potential consequences of non-compliance?,"The organization's cybersecurity education program is regularly validated using quantifiable measures and reported to business stakeholders. Non-compliance with this policy may result in disciplinary action, ranging from mandatory refresher training and written warnings to temporary suspension of remote access privileges, and potentially termination of employment or contractual obligations. Individuals could also face legal consequences under applicable laws if violations involve illegal activities.",complex,SANS_Education_Management_Policy_April2025.pdf|SANS_Education_Management_Policy_April2025.pdf,Safeguards|Safeguards,1|2,False,train
QA0513,What are the specific steps for handling a data breach incident?,The provided policy snippet does not specify the steps for handling a data breach incident.,negative,SANS_Resilience_Management_Policy_April2025.pdf,Safeguards,1,True,train
QA0514,What is the purpose of PNA-16?,PNA-16 mandates that web-based URL filtering systems decrypt all TLS-encrypted traffic to facilitate web-based URL filtering.,simple,SANS_Perimeter_Network_Access_Management_Policy_April2025.pdf,Safeguards,2,False,train
QA0515,"What are the potential consequences of non-compliance with the organization's cybersecurity policies, and how are these consequences determined?","Non-compliance with the organization's cybersecurity policies can result in disciplinary action, ranging from mandatory refresher training and written warnings to temporary suspension of remote access privileges and, in severe cases, termination of employment or contractual obligations. The severity of the action is determined based on the seriousness of the breach, with the enforcement process being consistent and impartial.",complex,SANS_Safeguard_Implementation_Management_Policy_April2025.pdf|SANS_Safeguard_Implementation_Management_Policy_April2025.pdf,Safeguards|Safeguards,1|2,False,train
QA0516,What are the potential consequences of violating the security policy regarding the use of cryptographic keys?,"Violating the security policy regarding the use of cryptographic keys can result in disciplinary action ranging from mandatory refresher training and written warnings to temporary suspension of remote access privileges and, in severe cases, termination of employment or contractual obligations.  Individuals could also face legal consequences under applicable laws if violations involve illegal activities.",complex,SANS_Acceptable_Encryption_Standard_April2025.pdf|SANS_Acceptable_Encryption_Standard_April2025.pdf,full|full,2|3,False,train
QA0517,What are the potential consequences for an employee who violates the policy regarding logging and alerting on data loss events in cloud services?,"Non-compliance with this policy may result in disciplinary action in line with our corporation's human resources procedures, including mandatory refresher training, written warnings, temporary suspension of remote access privileges, and, in severe cases, termination of employment or contractual obligations. Individuals could also face legal consequences under applicable laws if violations involve illegal activities.",complex,SANS_Cloud_Service_Provider_Management_Policy_April2025.pdf|SANS_Cloud_Service_Provider_Management_Policy_April2025.pdf,Safeguards|Safeguards,1|2,False,train
QA0518,What are the specific requirements for employee training on cybersecurity best practices?,This policy snippet does not specify the requirements for employee training on cybersecurity best practices.,negative,SANS_Software_Development_Management_Policy_April2025.pdf,Safeguards,0,True,train
QA0519,What are the specific regulations the organization must comply with when managing data?,The provided policy snippet does not specify the regulations the organization must comply with when managing data.,negative,SANS_Data_Inventory_Management_Policy_April2025.pdf,Safeguards,0,True,train
QA0520,What is the purpose of maintaining a cybersecurity forensics program?,The cybersecurity forensics program is expected to help the organization detect and respond to cybersecurity incidents.,simple,SANS_Resilience_Management_Policy_April2025.pdf,Safeguards,3,False,train
QA0521,What are potential consequences of non-compliance with this policy?,"Non-compliance with this policy may result in disciplinary action, ranging from mandatory refresher training and written warnings to temporary suspension of remote access privileges and, in severe cases, termination of employment or contractual obligations.",simple,SANS_Education_Management_Policy_April2025.pdf,Safeguards,2,False,train
QA0522,What actions are prohibited when conducting business for <Company Name>?,"Conducting business for <Company Name> is prohibited, even if authorized access is granted. This includes exporting software, technical information, encryption software or technology, violating international or regional export control laws, and engaging in activities that violate sexual harassment or hostile workplace laws.",simple,SANS_Acceptable_Use_Standard_April2025.pdf,Safeguards,4,False,test
QA0523,Which operating systems are allowed for use on the control system?,"The control system only allows the use of authorized operating system shells, such as Microsoft PowerShell or BASH.",simple,SANS_Software_Management_Policy_April2025.pdf,Safeguards,2,False,test
QA0524,What is the organization's policy regarding workforce member authentication credentials and how is it managed to ensure security?,"The organization's Human Resources (HR) program includes a process for workforce members to return authentication credentials after their work with the organization.  To enhance security, the organization maintains an inventory of each Identity Provider (IDP) it approves and minimizes the number of IDPs it uses. This is achieved through centralized Single Sign On (SSO) solutions whenever possible, and the organization also defines a process to regularly review its IDPs to ensure only authorized access is granted.",complex,SANS_Identity_Management_Policy_April2025.pdf|SANS_Identity_Management_Policy_April2025.pdf,Safeguards|Safeguards,0|1,False,test
QA0525,Who is responsible for maintaining an inventory of each Identity Provider (IDP) the organization approves?,The organization is responsible for maintaining an inventory of each approved Identity Provider (IDP).,simple,SANS_Identity_Management_Policy_April2025.pdf,Safeguards,1,False,test
QA0526,"According to the policies, what are two specific cybersecurity services that must be enabled to ensure the organization's operating systems are secure?","The policies require the organization to enable Data Execution Protection (DEP) and User Account Control (UAC) to enhance the security of its operating systems. These services protect against malicious code execution and unauthorized user actions, respectively.",complex,SANS_Configuration_Management_Policy_April2025.pdf|SANS_Configuration_Management_Policy_April2025.pdf,Safeguards|Safeguards,0|1,False,test
QA0527,What are the potential consequences for non-compliance with this policy?,"Policy non-compliance may result in disciplinary action, including mandatory training, written warnings, temporary suspension of remote access, and, in severe cases, termination of employment or contractual obligations. Individuals could also face legal consequences under applicable laws.",simple,SANS_Software_Development_Vulnerability_Management_Policy_April2025.pdf,Policy Sanctions,0,False,test
QA0528,Who must be informed if an AI system is being used to complete a task?,Users of AI systems should inform their manager and the department requesting the task.,simple,SANS_Artificial_Intelligence_Standard_April2025.pdf,full,13,False,test
