question_id,question,answer,question_type,source_filenames,source_sections,source_chunk_ids,is_impossible,dataset_split
QA0113,"According to the policy, what are the specific circumstances under which an employee should seek approval before using an AI system for work?","Employees should seek approval from their manager and HR representative before using an AI system to assist in tasks like writing a performance evaluation. This aligns with the guidelines outlined in snippet A about obtaining informed consent and appropriate content usage, as well as the high-risk use of AI systems identified in snippet B, particularly regarding the EU's classification of certain AI applications as posing a risk to health and safety or fundamental rights.",complex,SANS_Artificial_Intelligence_Standard_April2025.pdf|SANS_Artificial_Intelligence_Standard_April2025.pdf,full|full,13|14,False,train
QA0114,"What are the specific requirements for obtaining authorization to access data, servers, or accounts for purposes other than conducting business?","This policy snippet does not specify the requirements for obtaining authorization to access data, servers, or accounts for purposes other than conducting business.",negative,SANS_Acceptable_Use_Standard_April2025.pdf,Safeguards,3,True,train
QA0115,What is the purpose of the policy?,The policy outlines the need for procedures for labeling information based on its classification scheme.,simple,ISO-27001-Controls-List-Free-Download-pdf-.pdf,ISO_5.13,0,False,train
QA0116,What specific actions are required to ensure the organization's network devices are managed securely and are compliant with the organization's cybersecurity policy?,"The organization's network device management system must regularly scan for new devices, monitor each device's status, log and alert when offline, perform IP Address Management, record netflow data, compare configurations, and ensure the latest firmware is installed on each device to secure network devices and maintain compliance with the organization's cybersecurity policy.",complex,SANS_Network_Device_Management_Policy_April2025.docx|SANS_Network_Device_Management_Policy_April2025.docx,Safeguards|Safeguards,0|1,False,train
QA0117,Who is responsible for ensuring the organization's documented physical security program defines safeguards for how individuals can remove technology assets from the organization's facilities?,"The organization is responsible for defining safeguards for how individuals can remove technology assets from the organization's facilities, as stated in policy PHY-10.",simple,SANS_Physical_Security_Management_Policy_April2025.pdf,Safeguards,1,False,train
QA0118,Who is responsible for collecting and analyzing information security threats?,The policy states that information relating to information security threats should be collected and analyzed by individuals responsible for producing threat intelligence.,simple,ISO-27001-Controls-List-Free-Download-pdf-.pdf,ISO_5.7,0,False,train
QA0119,What is the policy's focus?,"The policy emphasizes the protection of information stored, processed, or accessible via user endpoint devices.",simple,ISO-27001-Controls-List-Free-Download-pdf-.pdf,ISO_8.1,0,False,train
QA0120,What is the purpose of PRV-13?,PRV-13 focuses on establishing a process for individuals to request the deletion of their data from the organization's records.,simple,SANS_Privacy_Management_Policy_April2025.pdf,Safeguards,2,False,train
QA0121,Who are the workforce members in this context?,The workforce members are the people employed by the organization.,simple,SANS_Identity_Management_Policy_April2025.pdf,Safeguards,0,False,train
QA0122,"According to the provided policy snippets, what type of data is considered 'Non-public YourCompanyName data' and who is considered a 'YourCompanyName Representative'?","Non-public YourCompanyName data is information that, if disclosed, could violate the privacy of individuals, government regulations or statutes, could jeopardize the financial state of YourCompanyName, could injure its reputation, or could reduce its competitive advantage. 'YourCompanyName Representatives' includes all YourCompanyName directors, officers, board members, employees, contractors, representatives, resellers and sub- resellers, distributors and sub-distributors, affiliates, agents, and any person or entity performing services for or on behalf of YourCompanyName.",complex,SANS_Artificial_Intelligence_Standard_April2025.pdf|SANS_Artificial_Intelligence_Standard_April2025.pdf,full|full,2|3,False,train
QA0123,What are potential consequences of non-compliance with this policy?,"Non-compliance may result in disciplinary action, including mandatory training, written warnings, temporary suspension of remote access, and, in severe cases, termination of employment or contractual obligations. Individuals may also face legal consequences depending on the nature of the violation.",simple,SANS_Password_Construction_Standard_April2025.pdf,Policy Sanctions,0,False,train
QA0124,What encryption algorithm must be used for all wireless connections?,The policy specifies that AES-CCMP encryption must be used for all wireless connections.,simple,SANS_Internal_Network_Access_Management_Policy_April2025.pdf,Safeguards,1,False,train
QA0125,"What are the potential consequences for non-compliance with the Access Control List (ACL) policy, and what actions are taken to ensure the policy is followed?","Non-compliance with the Access Control List (ACL) policy can lead to disciplinary action, ranging from mandatory refresher training and written warnings to temporary suspension of remote access privileges and, in severe cases, termination. The policy emphasizes the importance of cybersecurity and the role of individuals in protecting digital assets. Enforcement is consistent and impartial, with the severity of the action corresponding directly to the seriousness of the breach. The policy also mandates logging and alerting changes to group or role memberships or configured ACLs.",complex,SANS_Access_Management_Policy_April2025.pdf|SANS_Access_Management_Policy_April2025.pdf,Safeguards|Safeguards,1|2,False,train
QA0126,What are some potential consequences of non-compliance with this policy?,"Non-compliance may result in disciplinary action, including mandatory training, written warnings, temporary suspension of remote access, and, in severe cases, termination of employment or contractual obligations. Violations may also result in legal consequences under applicable laws.",simple,SANS_Data_Inventory_Management_Policy_April2025.pdf,Policy Sanctions,0,False,train
QA0127,Who is responsible for ensuring that the organization's Access Control Lists (ACLs) enforce encryption of data at rest?,The organization is responsible for ensuring that their Access Control Lists (ACLs) enforce encryption of data at rest on each computing system.,simple,SANS_Access_Management_Policy_April2025.pdf,Safeguards,1,False,train
QA0128,Which specific type of AI system is prohibited from handling personal data?,Open AI systems are prohibited from handling personal data.,simple,SANS_Artificial_Intelligence_Standard_April2025.pdf,full,15,False,train
QA0129,What is the purpose of the organization's aggregated information system logs?,The aggregated information system logs are intended to be used to track and alert authorized workforce members to appropriate events.,simple,SANS_Log_Management_Policy_April2025.pdf,Safeguards,0,False,train
QA0130,What is the purpose of regularly testing the Incident Management (IM) plans?,The policy requires the organization to regularly test its Incident Management (IM) plans to ensure their effectiveness and preparedness for responding to cybersecurity incidents.,simple,SANS_Resilience_Management_Policy_April2025.pdf,Safeguards,2,False,train
QA0131,"What are the potential consequences of violating the cybersecurity policy regarding email systems, and how might these consequences vary depending on the severity of the violation?","Violating the cybersecurity policy regarding email systems can result in disciplinary action ranging from mandatory refresher training and written warnings to temporary suspension of remote access privileges, and in severe cases, termination of employment or contractual obligations. The severity of the consequences will depend on the seriousness of the breach, with the enforcement process aiming to be consistent and impartial, ensuring that the action taken corresponds directly to the severity of the breach.",complex,SANS_Email_Management_Policy_April2025.pdf|SANS_Email_Management_Policy_April2025.pdf,Safeguards|Safeguards,1|2,False,train
QA0132,Who is responsible for maintaining the documented Business Continuity and Disaster Recovery (BCP/DR) program?,The organization is responsible for maintaining the documented Business Continuity and Disaster Recovery (BCP/DR) program.,simple,SANS_Resilience_Management_Policy_April2025.pdf,Safeguards,0,False,train
QA0133,Which type of filtering does the organization's approved perimeter network firewalls perform for inbound and outbound connections?,"The organization's approved perimeter network firewalls perform protocol-based filtering for both inbound and outbound connections, including TCP, UDP, and similar protocols.",simple,SANS_Perimeter_Network_Access_Management_Policy_April2025.pdf,Safeguards,0,False,train
QA0134,Who must sign the agreed-upon contract terms?,Each of the organization's third parties that store or process any of the organization's technology systems or data must sign the agreed-upon contract terms.,simple,SANS_Third_Party_Management_Policy_April2025.pdf,Safeguards,2,False,train
QA0135,What type of AI system is defined in the policy?,The policy defines an 'Open AI system' as an AI system where the input provided by all users is used to train the AI model. This means that the input data from all users is not private and may be revealed to other users.,simple,SANS_Artificial_Intelligence_Standard_April2025.pdf,full,3,False,train
QA0136,What types of alerts are tracked by the log management system?,"The policy does not specify the types of alerts tracked by the log management system, only that a log management system should be implemented to track them.",simple,SANS_Log_Management_Policy_April2025.pdf,Safeguards,2,False,train
QA0137,What is the purpose of the cybersecurity safeguard validation (audit) plan?,The cybersecurity safeguard validation (audit) plan is a multi-year plan that documents the assessments the organization will perform to validate the quality of its cybersecurity safeguards.,simple,SANS_Safeguard_Validation_Management_Policy_April2025.pdf,Safeguards,0,False,train
QA0138,Who is responsible for network device management within the organization?,"Network administrators, IT managers, and security personnel are all responsible for network device management processes.",simple,SANS_Network_Device_Management_Policy_April2025.docx,Scope,0,False,train
QA0139,"Based on the provided policy snippets, what specific security measures must the organization implement to ensure secure operating system configurations?","The organization must define a configuration benchmark that includes disabling unnecessary services, such as scripting languages, and enabling advanced logging.  The benchmark also requires the organization to enforce cybersecurity services like DEP, ASLR, and UAC, and to disable unnecessary wireless protocols and networks on endpoints.  This ensures a secure operating system environment by limiting the attack surface and enhancing system integrity.",complex,SANS_Configuration_Management_Policy_April2025.pdf|SANS_Configuration_Management_Policy_April2025.pdf,Safeguards|Safeguards,0|1,False,train
QA0140,"What are the responsibilities of the organization's data inventory system regarding the automatic discovery and classification of data, especially when it involves third-party environments?","The data inventory system must automatically discover and classify all data managed by the organization, both on-site and at third-party environments.  It should also automatically classify data based on its sensitivity, criticality, and business purpose, and integrate with the organization's asset inventory system for a complete picture of data location and management.",complex,SANS_Data_Inventory_Management_Policy_April2025.pdf|SANS_Data_Inventory_Management_Policy_April2025.pdf,Safeguards|Safeguards,1|2,False,train
QA0141,"Which of the following cybersecurity penetration testing scopes must be included in the organization's cybersecurity safeguard validation (audit) plan, as defined in both snippets?","The organization's cybersecurity safeguard validation (audit) plan must include software application penetration tests, as defined in snippet B, and red team cybersecurity assessments, as defined in snippet A.",complex,SANS_Safeguard_Validation_Management_Policy_April2025.pdf|SANS_Safeguard_Validation_Management_Policy_April2025.pdf,Safeguards|Safeguards,0|1,False,train
QA0142,What is the purpose of maintaining a cybersecurity configuration benchmark for each of the organization's authorized Cloud Service Providers (CSPs)?,Maintaining a cybersecurity configuration benchmark ensures that the organization's authorized Cloud Service Providers (CSPs) meet security standards.,simple,SANS_Cloud_Service_Provider_Management_Policy_April2025.pdf,Safeguards,0,False,train
QA0143,What are the potential consequences for non-compliance with the privileged account management policy?,"Non-compliance with the privileged account management policy may result in disciplinary action in line with our corporation's human resources procedures, ranging from mandatory refresher training and written warnings to temporary suspension of remote access privileges and, in severe cases, termination of employment or contractual obligations. Individuals could also face legal consequences under applicable laws if violations involve illegal activities.",complex,SANS_Privileged_Account_Management_Policy_April2025.pdf|SANS_Privileged_Account_Management_Policy_April2025.pdf,Safeguards|Safeguards,1|2,False,train
QA0144,How should the authority of the stakeholder committee responsible for the program be established?,The cybersecurity program charter must establish the authority of the stakeholder committee.,simple,SANS_Program_Management_Policy_April2025.pdf,Safeguards,1,False,train
QA0145,Who is responsible for defining the cybersecurity program charter?,The organization is responsible for defining the cybersecurity program charter.,simple,SANS_Program_Management_Policy_April2025.pdf,Safeguards,0,False,train
QA0146,"According to the policies, what activities are prohibited when employees use <Company Name> resources for personal use, and what are the consequences of such actions?","The policies state that accessing data, a server, or an account for any purpose other than conducting <Company Name> business is prohibited. The consequences of such actions are not explicitly stated in the provided snippets, but the policy clearly states that unauthorized copying of copyrighted material, including software products, is strictly prohibited.",complex,SANS_Acceptable_Use_Standard_April2025.pdf|SANS_Acceptable_Use_Standard_April2025.pdf,Safeguards|Safeguards,2|3,False,train
QA0147,What are some of the methods used in AI techniques and approaches?,"AI techniques and approaches include supervised, unsupervised, and reinforcement learning, as well as logic and knowledge-based approaches, statistical approaches, and Bayesian estimation.",simple,SANS_Artificial_Intelligence_Standard_April2025.pdf,full,19,False,train
QA0148,What is the purpose of the organization's Mobile Device Management (MDM) system?,"The MDM system is designed to enforce cybersecurity safeguards on each organization's mobile device, including phones and tablets.",simple,SANS_Mobile_Device_Management_Policy_April2025.pdf,Safeguards,0,False,train
QA0149,Who is responsible for assigning resources to address cybersecurity projects and issues?,The organization is responsible for assigning appropriate resources to address cybersecurity projects and issues in a timely manner.,simple,SANS_Safeguard_Implementation_Management_Policy_April2025.pdf,Safeguards,1,False,train
QA0150,"What is the process the organization will use to ensure that the logs from the organization's information systems are reviewed regularly, and who is responsible for monitoring the logs?","The organization shall define a process to regularly review the logs aggregated from its information systems. This process includes defining clear Service Level Agreements (SLAs) for who should monitor the logs, such as a Security Operations Center (SOC). Additionally, the organization will automate the review of aggregated logs and alerts on threats discovered by its aggregate log management system.",complex,SANS_Log_Management_Policy_April2025.pdf|SANS_Log_Management_Policy_April2025.pdf,Safeguards|Safeguards,0|1,False,train
QA0151,What is the policy's focus?,The policy emphasizes the need to protect assets that are located off-premises.,simple,ISO-27001-Controls-List-Free-Download-pdf-.pdf,ISO_7.9,0,False,train
QA0152,"Which cybersecurity safeguards are expected to be mapped by the organization's Governance, Risk, and Compliance (GRC) or similar cybersecurity business intelligence software platform?",The platform is expected to map cybersecurity tools against approved and prioritized cybersecurity safeguards.,simple,SANS_Risk_Communication_Management_Policy_April2025.pdf,Safeguards,0,False,train
QA0153,"What are the potential consequences of not complying with the organization's physical security program, particularly regarding the security of technology assets like multi-function devices?","Non-compliance with the physical security program may result in disciplinary action, ranging from mandatory refresher training and written warnings to temporary suspension of remote access privileges and, in severe cases, termination of employment or contractual obligations.  Individuals could also face legal consequences under applicable laws if violations involve illegal activities.",complex,SANS_Physical_Security_Management_Policy_April2025.pdf|SANS_Physical_Security_Management_Policy_April2025.pdf,Safeguards|Safeguards,1|2,False,train
QA0154,What is the primary concern regarding database credentials?,"The primary concern is that improperly stored credentials may be compromised, leading to a compromise of the database.",simple,SANS_Database_Credentials_Standard_April2025.pdf,full,0,False,train
QA0155,What are the rules for the secure development of software and systems?,The rules for the secure development of software and systems should be established and applied.,simple,ISO-27001-Controls-List-Free-Download-pdf-.pdf,ISO_8.25,0,False,train
QA0156,"According to the policy, what should be segregated within the organization's networks?","Information services, users, and information systems should be segregated.",simple,ISO-27001-Controls-List-Free-Download-pdf-.pdf,ISO_8.22,0,False,train
QA0157,What specific types of legal consequences could someone face for violating this policy?,The policy does not specify the specific types of legal consequences that could be faced for policy violations.,negative,SANS_Email_Management_Policy_April2025.pdf,Safeguards,2,True,train
QA0158,Which process does PRV-14 describe?,"PRV-14 outlines the process for sharing data with third parties, ensuring it is only done with appropriate data.",simple,SANS_Privacy_Management_Policy_April2025.pdf,Safeguards,2,False,train
QA0159,Which system component should be used to ensure authorized software can execute?,The organization should utilize a software application control system on each computing system to ensure only authorized software can execute.,simple,SANS_Software_Management_Policy_April2025.pdf,Safeguards,1,False,train
QA0160,Who is responsible for ensuring that proprietary information is protected?,Employees are responsible for ensuring that proprietary information is protected in accordance with the Data Protection Standard.,simple,SANS_Acceptable_Use_Standard_April2025.pdf,Safeguards,0,False,train
QA0161,What is the purpose of the organization's Endpoint Detection and Response (EDR) system?,The EDR system generates a database of file hashes for cybersecurity incident response.,simple,SANS_System_Protection_Management_Policy_April2025.pdf,Safeguards,1,False,train
QA0162,What are the security measures required for working in secure areas?,The policy requires the design and implementation of security measures for working in secure areas.,simple,ISO-27001-Controls-List-Free-Download-pdf-.pdf,ISO_7.6,0,False,train
QA0163,Who is responsible for ensuring the organization's cybersecurity safeguard documentation clearly defines a quantifiable measure of compliance for each documented cybersecurity safeguard?,The organization is responsible for ensuring that the documentation clearly defines a quantifiable measure of compliance for each documented cybersecurity safeguard.,simple,SANS_Safeguard_Selection_Management_Policy_April2025.pdf,Safeguards,2,False,train
QA0164,Who must be consulted before using an AI system for personal use?,Prior approval from the appropriate department leader is required for using an AI system for personal use.,simple,SANS_Artificial_Intelligence_Standard_April2025.pdf,full,14,False,train
QA0165,What are the potential consequences for individuals who violate this policy?,"The consequences for violating this policy can range from mandatory refresher training and written warnings to temporary suspension of remote access privileges and, in severe cases, termination of employment or contractual obligations.",simple,SANS_Mobile_Device_Management_Policy_April2025.pdf,Policy Sanctions,0,False,train
QA0166,What security mechanisms are required for network services?,"The policy states that security mechanisms for network services must be identified, implemented, and monitored.",simple,ISO-27001-Controls-List-Free-Download-pdf-.pdf,ISO_8.21,0,False,train
QA0167,What are security perimeters used for?,Security perimeters are used to protect areas containing information and other associated assets.,simple,ISO-27001-Controls-List-Free-Download-pdf-.pdf,ISO_7.1,0,False,train
QA0168,"According to the policy documents, what specific precautions should be taken when using AI systems for personnel decisions, such as promotions, retention, and similar decisions?","The policy documents emphasize the need for extreme caution when using AI systems for personnel decisions like promotions, retention, or similar decisions.  This includes avoiding biases, both in the data sets used and in the systems themselves, to ensure fair and equitable outcomes.  The documents also highlight the potential for legal issues arising from biased AI use in these areas, such as discrimination against protected classes.",complex,SANS_Artificial_Intelligence_Standard_April2025.pdf|SANS_Artificial_Intelligence_Standard_April2025.pdf,full|full,14|15,False,train
QA0169,What is the purpose of data masking?,"Data masking is used in accordance with the organizations topic-specific policy on access control and other related topic-specific policies, and business requirements, taking applicable legislation into consideration.",simple,ISO-27001-Controls-List-Free-Download-pdf-.pdf,ISO_8.11,0,False,train
QA0170,What specific security controls are mandated for data stored in the cloud?,The provided policy snippet does not specify security controls for data stored in the cloud.,negative,SANS_Data_Inventory_Management_Policy_April2025.pdf,Safeguards,1,True,train
QA0171,Who has access to high-quality datasets for the development of high-risk AI systems?,"Certain actors, such as providers, notified bodies, digital innovation hubs, testing experimentation facilities, and researchers, have access to high-quality datasets relevant to their respective fields of activities.",simple,SANS_Artificial_Intelligence_Standard_April2025.pdf,full,22,False,train
QA0172,Who is responsible for implementing data leakage prevention measures?,"Systems, networks, and devices that process, store, or transmit sensitive information are subject to data leakage prevention measures.",simple,ISO-27001-Controls-List-Free-Download-pdf-.pdf,ISO_8.12,0,False,train
QA0173,Who is informed about how their data is being used and the organization's privacy goals?,Customers and external business partners are informed about how their data is being used and the organization's privacy goals according to the policy.,simple,SANS_Privacy_Management_Policy_April2025.pdf,Safeguards,1,False,train
QA0174,"What are the consequences of violating the organization's Vulnerability Management (VM) policy, and how are those consequences reported?","Violations of the organization's Vulnerability Management (VM) policy can result in disciplinary action, ranging from mandatory refresher training and written warnings to temporary suspension of remote access privileges and, in severe cases, termination of employment or contractual obligations. The policy also emphasizes the importance of cybersecurity, the individual's role in protecting digital assets, and the potential risks associated with non-compliance, which are reported through regular reporting of discovered vulnerabilities to various levels of staff, including technical staff, business unit staff, and business leadership staff.",complex,SANS_Vulnerability_Management_Policy_April2025.pdf|SANS_Vulnerability_Management_Policy_April2025.pdf,Safeguards|Safeguards,0|1,False,train
